drop table if exists DEMO;
drop table if exists class;
Warnings:
Note	1051	Unknown table 'test.class'
drop table if exists my_foreign1;
Warnings:
Note	1051	Unknown table 'test.my_foreign1'
create table class(id int primary key auto_increment,c_name varchar(20) not null,room varchar(20));
create table my_foreign1(id int primary key auto_increment,
name varchar(20) not null comment '学生姓名',
c_id int comment '班级表ID',
CONSTRAINT fk_id foreign key(c_id) references class(id)	
);
insert into class values(1,'abc','aaa');
insert into class values(2,'abc2','bbb');
insert into class values(3,'abc3','ccc');
insert into class values(4,'4','4');
select * from class;
id	c_name	room
1	abc	aaa
2	abc2	bbb
3	abc3	ccc
4	4	4
insert into my_foreign1 values(null,'Charies','6');
ERROR 23000: Cannot add or update a child row: a foreign key constraint fails (Referenced key value not found in parent tables(test.class))
insert into my_foreign1 values(null,'Charies','1');
insert into my_foreign1 values(null,'Bob','2');
insert into my_foreign1 values(null,'Bob1','3');
select * from my_foreign1;
id	name	c_id
2	Charies	1
3	Bob	2
4	Bob1	3
delete from class where id = 2;
ERROR 23000: Cannot delete or update a parent row: a foreign key constraint fails (Record is referenced by child tables(test.my_foreign1))
delete from class;
ERROR 23000: Cannot delete or update a parent row: a foreign key constraint fails (Record is referenced by child tables(test.my_foreign1))
update class set id = 100 where id = 2;
ERROR 23000: Cannot delete or update a parent row: a foreign key constraint fails (Record is referenced by child tables(test.my_foreign1))
update class set id = 100 where id = 4;
delete from class where id = 100;
truncate table class;
ERROR 42000: Cannot truncate a table referenced in a foreign key constraint (`test`.`my_foreign1`, CONSTRAINT `fk_id`)
drop table class;
ERROR HY000: Cannot drop table 'class' referenced by a foreign key constraint 'fk_id' on table 'my_foreign1'.
truncate table my_foreign1;
truncate table class;
ERROR 42000: Cannot truncate a table referenced in a foreign key constraint (`test`.`my_foreign1`, CONSTRAINT `fk_id`)
drop table class,my_foreign1;
create table class(id int, age int, c_name varchar(20), room varchar(20), primary key(id, age));
create table my_foreign1(id int primary key auto_increment,
name varchar(20) not null,
c_id int,
a_id int,
CONSTRAINT fk_id foreign key(c_id, a_id) references class(id, age)	
);
desc my_foreign1;
Field	Type	Null	Key	Default	Extra
id	int	NO	PRI	NULL	auto_increment
name	varchar(20)	NO		NULL	
c_id	int	YES	MUL	NULL	
a_id	int	YES		NULL	
insert into class values(1, 1, 'abc','aaa');
insert into class values(2, 4,'abc2','bbb');
insert into class values(3, 3,'abc3','ccc');
select * from class;
id	age	c_name	room
1	1	abc	aaa
2	4	abc2	bbb
3	3	abc3	ccc
insert into my_foreign1 values(null,'Charies','6','12');
ERROR 23000: Cannot add or update a child row: a foreign key constraint fails (Referenced key value not found in parent tables(test.class))
insert into my_foreign1 values(null,'Alex','2','4');
insert into my_foreign1 values(null,'ss','7','12');
ERROR 23000: Cannot add or update a child row: a foreign key constraint fails (Referenced key value not found in parent tables(test.class))
insert into my_foreign1 values(null,'test','3','3');
select * from my_foreign1;
id	name	c_id	a_id
2	Alex	2	4
4	test	3	3
drop table my_foreign1;
drop table class;
create table class(id int primary key auto_increment, c_name varchar(20), room varchar(20));
create table project(id int primary key auto_increment, name varchar(10));
create table my_foreign1(id int primary key auto_increment,
name varchar(20) not null,
c_id int,
a_id int,
CONSTRAINT fk_cid foreign key(c_id) references class(id),
CONSTRAINT fk_aid foreign key(a_id) references project(id)
);
desc my_foreign1;
Field	Type	Null	Key	Default	Extra
id	int	NO	PRI	NULL	auto_increment
name	varchar(20)	NO		NULL	
c_id	int	YES	MUL	NULL	
a_id	int	YES	MUL	NULL	
insert into class values(1,'abc','aaa');
insert into class values(2,'abc2','bbb');
insert into class values(3,'abc3','ccc');
select * from class;
id	c_name	room
1	abc	aaa
2	abc2	bbb
3	abc3	ccc
insert into project values(4,'proj1');
insert into project values(6,'proj2');
select * from project;
id	name
4	proj1
6	proj2
insert into my_foreign1 values(null,'Charies','1','5');
ERROR 23000: Cannot add or update a child row: a foreign key constraint fails (Referenced key value not found in parent tables(test.project, test.class))
insert into my_foreign1 values(null,'Alex','1','4');
insert into my_foreign1 values(null,'ss','7','12');
ERROR 23000: Cannot add or update a child row: a foreign key constraint fails (Referenced key value not found in parent tables(test.project, test.class))
insert into my_foreign1 values(null,'test','3','6');
select * from my_foreign1;
id	name	c_id	a_id
2	Alex	1	4
4	test	3	6
drop table my_foreign1;
drop table project;
drop table class;
drop table if exists class;
Warnings:
Note	1051	Unknown table 'test.class'
drop table if exists my_foreign1;
Warnings:
Note	1051	Unknown table 'test.my_foreign1'
create table class(id int primary key auto_increment,c_name varchar(20) not null,room varchar(20));
create table my_foreign1(id int primary key auto_increment,
name varchar(20) not null comment '学生姓名',
c_id int comment '班级表ID'
);
alter table my_foreign1 add constraint fk_id foreign key(c_id) references class(id);
insert into class values(1,'abc','aaa');
insert into class values(2,'abc2','bbb');
insert into class values(3,'abc3','ccc');
select * from class;
id	c_name	room
1	abc	aaa
2	abc2	bbb
3	abc3	ccc
insert into my_foreign1 values(null,'Charies','6');
ERROR 23000: Cannot add or update a child row: a foreign key constraint fails (Referenced key value not found in parent tables(test.class))
insert into my_foreign1 values(null,'Charies','1');
insert into my_foreign1 values(null,'Bob','1');
select * from my_foreign1;
id	name	c_id
2	Charies	1
3	Bob	1
ALTER TABLE my_foreign1 DROP FOREIGN KEY fk_id;
insert into my_foreign1 values(null,'Charies','6');
drop table my_foreign1;
drop table class;
create table parent (a int primary key, b int);
create table child (a int, b int, foreign key (a) references parent(a) on delete set null);
insert into parent values (1,1),(2,2),(3,3),(4,4);
insert into child values (1,1),(2,2),(3,3);
delete from parent where a = 1;
select * from child;
a	b
NULL	1
2	2
3	3
drop table child;
create table child (a int, b int, foreign key (a) references parent(a) on delete cascade);
insert into child values (2,2),(3,3);
delete from parent where a = 2;
select * from child;
a	b
3	3
drop table child;
drop table parent;
drop table if exists my_parent1;
Warnings:
Note	1051	Unknown table 'test.my_parent1'
CREATE TABLE my_parent1 (fk_id int PRIMARY KEY);
drop table if exists my_parent2;
Warnings:
Note	1051	Unknown table 'test.my_parent2'
CREATE TABLE my_parent2 (fk_id int PRIMARY KEY);
drop table if exists my_child;
Warnings:
Note	1051	Unknown table 'test.my_child'
CREATE TABLE my_child (
id1 int, id2 int, PRIMARY KEY (id1, id2),
CONSTRAINT id1_fkey FOREIGN KEY (id1) REFERENCES my_parent1 (fk_id),
CONSTRAINT id2_fkey FOREIGN KEY (id2) REFERENCES my_parent2 (fk_id)
);
drop table my_child;
drop table my_parent1;
drop table my_parent2;
drop table if exists class;
Warnings:
Note	1051	Unknown table 'test.class'
drop table if exists my_foreign1;
Warnings:
Note	1051	Unknown table 'test.my_foreign1'
create table class(id int primary key auto_increment,c_name varchar(20) not null,room varchar(20));
create table my_foreign1(id int primary key auto_increment,
name varchar(20) not null comment '学生姓名',
c_id int comment '班级表ID',
CONSTRAINT fk_id foreign key(c_id) references class(id)	
);
insert into class values(1,'abc','aaa');
insert into class values(2,'abc2','bbb');
insert into class values(3,'abc3','ccc');
insert into class values(4,'4','4');
select * from class;
id	c_name	room
1	abc	aaa
2	abc2	bbb
3	abc3	ccc
4	4	4
insert into my_foreign1 values(null,'Charies','6');
ERROR 23000: Cannot add or update a child row: a foreign key constraint fails (Referenced key value not found in parent tables(test.class))
SET FOREIGN_KEY_CHECKS = 0;
insert into my_foreign1 values(null,'Charies','6');
SET FOREIGN_KEY_CHECKS = 1;
insert into my_foreign1 values(null,'Charies','1');
insert into my_foreign1 values(null,'Bob','2');
insert into my_foreign1 values(null,'Bob1','3');
select * from my_foreign1;
id	name	c_id
2	Charies	6
3	Charies	1
4	Bob	2
5	Bob1	3
delete from class where id = 2;
ERROR 23000: Cannot delete or update a parent row: a foreign key constraint fails (Record is referenced by child tables(test.my_foreign1))
SET FOREIGN_KEY_CHECKS = 0;
delete from class where id = 2;
SET FOREIGN_KEY_CHECKS = 1;
delete from class;
ERROR 23000: Cannot delete or update a parent row: a foreign key constraint fails (Record is referenced by child tables(test.my_foreign1))
SET FOREIGN_KEY_CHECKS = 0;
delete from class;
SET FOREIGN_KEY_CHECKS = 1;
insert into class values(2,'abc2','bbb');
update class set id = 100 where id = 2;
ERROR 23000: Cannot delete or update a parent row: a foreign key constraint fails (Record is referenced by child tables(test.my_foreign1))
SET FOREIGN_KEY_CHECKS = 0;
update class set id = 100 where id = 2;
SET FOREIGN_KEY_CHECKS = 1;
update class set id = 101 where id = 4;
delete from class where id = 100;
truncate table class;
ERROR 42000: Cannot truncate a table referenced in a foreign key constraint (`test`.`my_foreign1`, CONSTRAINT `fk_id`)
drop table class;
ERROR HY000: Cannot drop table 'class' referenced by a foreign key constraint 'fk_id' on table 'my_foreign1'.
truncate table my_foreign1;
truncate table class;
ERROR 42000: Cannot truncate a table referenced in a foreign key constraint (`test`.`my_foreign1`, CONSTRAINT `fk_id`)
drop table class,my_foreign1;
create table t1(far_id int primary key, v int);
create table t2(id int, sun_id int, CONSTRAINT t1t2_key FOREIGN KEY (sun_id) REFERENCES t1(far_id));
create table t3(i int);
drop table t1;
ERROR HY000: Cannot drop table 't1' referenced by a foreign key constraint 't1t2_key' on table 't2'.
drop table t1, t3;
ERROR HY000: Cannot drop table 't1' referenced by a foreign key constraint 't1t2_key' on table 't2'.
drop table t1,t2;
drop table t3;
SET @@foreign_key_checks= 1;
CREATE TABLE t1(a INT PRIMARY KEY);
CREATE TABLE t2(a INT, b INT, FOREIGN KEY(a) REFERENCES t1(a));
ALTER TABLE t2 ADD FOREIGN KEY(b) REFERENCES t1(a);
ALTER TABLE t2 DROP FOREIGN KEY t2_fk_1;
ALTER TABLE t2 ADD FOREIGN KEY(a) REFERENCES t1(a);
ALTER TABLE t2 RENAME TO t3;
ALTER TABLE t3 RENAME TO t4, ALGORITHM= INPLACE;
ALTER TABLE t4 RENAME TO t5;
RENAME TABLE t5 TO t6;
DROP TABLE t6;
CREATE TABLE `t6` (
`a` int(11) DEFAULT NULL,
`b` int(11) DEFAULT NULL,
KEY `b` (`b`),
KEY `a` (`a`),
CONSTRAINT `t6_fk_2` FOREIGN KEY (`b`) REFERENCES `t1` (`a`),
CONSTRAINT `t6_fk_3` FOREIGN KEY (`a`) REFERENCES `t1` (`a`)
) ENGINE=CTC DEFAULT CHARSET=latin1;
Warnings:
Warning	1681	Integer display width is deprecated and will be removed in a future release.
Warning	1681	Integer display width is deprecated and will be removed in a future release.
RENAME TABLE t6 TO t2;
SELECT constraint_name FROM information_schema.referential_constraints
WHERE table_name = 't2' ORDER BY constraint_name;
CONSTRAINT_NAME
t2_fk_2
t2_fk_3
ALTER TABLE t2 DROP FOREIGN KEY t2_fk_2, DROP FOREIGN KEY t2_fk_3;
drop table t1,t2;
SET @@foreign_key_checks= 1;
create table t1 (f1 int unique, f2 int);
INSERT INTO t1 VALUES (1, 80);
INSERT INTO t1 VALUES (2, 81);
create table t2 (f1 int, f2 int);
INSERT INTO t2 VALUES (51, 1);
INSERT INTO t2 VALUES (52, 2);
INSERT INTO t2 VALUES (53, 3);
alter table t2 add constraint c1 foreign key (f2) references t1(f1) on update cascade;
ERROR 23000: Cannot add or update a child row: a foreign key constraint fails.
drop table t1,t2;
SET @@foreign_key_checks=0;
create table student(id int, name varchar(6000), class int, constraint fk foreign key(class) references class(id));
SET @@foreign_key_checks=1;
create table class(a int);
ERROR HY000: Cannot add foreign key constraint
drop table student;
SET @@foreign_key_checks=0;
create table student(id int primary key, name varchar(6000), class int, constraint fk foreign key(class) references class(id));
SET @@foreign_key_checks=1;
create table class(a int);
ERROR HY000: Cannot add foreign key constraint
drop table student;
SET @@foreign_key_checks=0;
create table student(id int, name varchar(6000), class char(20), constraint fk foreign key(class) references class(id));
SET @@foreign_key_checks=1;
create table class(a int);
ERROR HY000: Cannot add foreign key constraint
drop table student;
SET @@foreign_key_checks=0;
create table student(id int, name varchar(6000), class int, constraint fk foreign key(class) references class(a));
SET @@foreign_key_checks=1;
create table class(a int);
ERROR HY000: Cannot add foreign key constraint
drop table student;
