drop database if exists test_DB;
Warnings:
Note	1008	Can't drop database 'test_DB'; database doesn't exist
create database test_DB;
use test_DB;
create table t1 (a int, b int, c int, d int);
create index idx1 on t1 (d, c, b);
insert into t1 values (1,2,null,4);
insert into t1 values (1,2,3,null);
insert into t1 values (1,2,3,4);
select b from t1 where b = 2;
b
2
2
2
select b, c from t1;
b	c
2	3
2	NULL
2	3
select d from t1;
d
NULL
4
4
select a, b from t1;
a	b
1	2
1	2
1	2
select * from t1;
a	b	c	d
1	2	NULL	4
1	2	3	NULL
1	2	3	4
drop table t1;
create table t2 (a int, b int, c int, d int);
create index idx2 on t2 (d, a, c, b);
insert into t2 values (1,2,null,4);
insert into t2 values (1,2,3,null);
insert into t2 values (1,2,3,4);
select a from t2 where a = 1;
a
1
1
1
select b, c from t2;
b	c
2	3
2	NULL
2	3
select d from t2;
d
NULL
4
4
select * from t2;
a	b	c	d
1	2	3	NULL
1	2	NULL	4
1	2	3	4
drop table t2;
create table t3 (a int, b int, c int, d int);
insert into t3 values (1,2,3,4);
insert into t3 values (1,2,3,4);
insert into t3 values (1,2,3,4);
select a from t3 where a = 1;
a
1
1
1
select b, c from t3;
b	c
2	3
2	3
2	3
select d from t3;
d
4
4
4
select * from t3;
a	b	c	d
1	2	3	4
1	2	3	4
1	2	3	4
drop table t3;
create table t4 (a int, b int, c int, d int, e int, f int);
create index idx4 on t4 (f,e,d);
insert into t4 values (1,2,3,4,null,6);
insert into t4 values (1,2,3,4,5,null);
insert into t4 values (1,2,3,4,5,6);
insert into t4 values (1,2,3,4,5,6);
select * from t4;
a	b	c	d	e	f
1	2	3	4	NULL	6
1	2	3	4	5	NULL
1	2	3	4	5	6
1	2	3	4	5	6
alter table t4 drop column a;
select d from t4 where d = 4;
d
4
4
4
4
select * from t4 where d = 4;
b	c	d	e	f
2	3	4	NULL	6
2	3	4	5	NULL
2	3	4	5	6
2	3	4	5	6
alter table t4 drop column b;
select d from t4 where d = 4;
d
4
4
4
4
select * from t4 where f = 6;
c	d	e	f
3	4	NULL	6
3	4	5	6
3	4	5	6
drop table t4;
create table t5 (a int, b int, c int, d int, e int, f int);
insert into t5 values (1,2,3,4,null,6);
insert into t5 values (1,2,3,4,5,null);
insert into t5 values (1,2,3,4,5,6);
insert into t5 values (1,2,3,4,5,6);
select * from t5;
a	b	c	d	e	f
1	2	3	4	NULL	6
1	2	3	4	5	NULL
1	2	3	4	5	6
1	2	3	4	5	6
alter table t5 drop column a;
select d from t5 where d = 4;
d
4
4
4
4
select * from t5 where d = 4;
b	c	d	e	f
2	3	4	NULL	6
2	3	4	5	NULL
2	3	4	5	6
2	3	4	5	6
alter table t5 drop column b;
select d from t5 where d = 4;
d
4
4
4
4
drop table t5;
create table t6(id int, v json)default CHARACTER SET=ascii;
insert into t6 values(1,'[0,1.1, "abc", "00:00:00", "1000-01-01 00:00:00", "1000-01-01", "2155", {"k1":1}, [1,2], true, null]');
select * from t6 where id=1;
id	v
1	[0, 1.1, "abc", "00:00:00", "1000-01-01 00:00:00", "1000-01-01", "2155", {"k1": 1}, [1, 2], true, null]
insert into t6 values(2,'{"k1":1, "k2":1.5, "k3":"abc", "k4":"00:00:00", "k5":"1000-01-01 00:00:00","k6":"1000-01-01","k7":"2155","k8":{"k1":1},"k9":[1,2],"k10":true, "k11":null}');
select * from t6 where id=2;
id	v
2	{"k1": 1, "k2": 1.5, "k3": "abc", "k4": "00:00:00", "k5": "1000-01-01 00:00:00", "k6": "1000-01-01", "k7": "2155", "k8": {"k1": 1}, "k9": [1, 2], "k10": true, "k11": null}
update t6 set v='[1]' where id=1;
select * from t6;
id	v
1	[1]
2	{"k1": 1, "k2": 1.5, "k3": "abc", "k4": "00:00:00", "k5": "1000-01-01 00:00:00", "k6": "1000-01-01", "k7": "2155", "k8": {"k1": 1}, "k9": [1, 2], "k10": true, "k11": null}
drop table t6;
drop database test_DB;
