drop table if exists DEMO;
create table DEMO (ID integer not null, NAME varchar(19), AGE integer, GRADE real);
insert into DEMO values (1, 'LIOR', 35, 6.9);
insert into DEMO values (4, 'MIKE', 55, 99.92);
insert into DEMO values (8, 'ROMAN', 40, 94.1);
insert into DEMO values (16, 'DAN', 60, 1234567890);
insert into DEMO values (32, 'ZVI', 35, 777.666);
insert into DEMO values (1, 'Eitan', NULL, 4.9);
insert into DEMO values (888888, 'zhangdi', NULL, 10000.8);
insert into DEMO values (1131, 'Hisses', 1, NULL);
SELECT * FROM DEMO;
ID	NAME	AGE	GRADE
1	LIOR	35	6.9
4	MIKE	55	99.92
8	ROMAN	40	94.1
16	DAN	60	1234567890
32	ZVI	35	777.666
1	Eitan	NULL	4.9
888888	zhangdi	NULL	10000.8
1131	Hisses	1	NULL
ALTER TABLE DEMO ADD PRIMARY KEY (ID);
ERROR 23000: Duplicate entry '1' for key 'DEMO.PRIMARY'
DELETE FROM DEMO WHERE GRADE = 4.9;
ALTER TABLE DEMO ADD PRIMARY KEY (ID);
create table DEMO_A (ID integer not null, NAME varchar(19) not null, SCORE float, CONSTRAINT id_fk FOREIGN KEY (ID) REFERENCES DEMO(ID));
desc DEMO_A;
Field	Type	Null	Key	Default	Extra
ID	int	NO	MUL	NULL	
NAME	varchar(19)	NO		NULL	
SCORE	float	YES		NULL	
show create table DEMO_A;
Table	Create Table
DEMO_A	CREATE TABLE `DEMO_A` (
  `ID` int NOT NULL,
  `NAME` varchar(19) NOT NULL,
  `SCORE` float DEFAULT NULL,
  KEY `id_fk` (`ID`),
  CONSTRAINT `id_fk` FOREIGN KEY (`ID`) REFERENCES `DEMO` (`ID`)
) ENGINE=CTC DEFAULT CHARSET=utf8mb4 COLLATE=utf8mb4_0900_ai_ci
alter table DEMO_A drop CONSTRAINT id_fk;
show create table DEMO_A;
Table	Create Table
DEMO_A	CREATE TABLE `DEMO_A` (
  `ID` int NOT NULL,
  `NAME` varchar(19) NOT NULL,
  `SCORE` float DEFAULT NULL,
  KEY `id_fk` (`ID`)
) ENGINE=CTC DEFAULT CHARSET=utf8mb4 COLLATE=utf8mb4_0900_ai_ci
alter table DEMO_A drop index id_fk;
show create table DEMO_A;
Table	Create Table
DEMO_A	CREATE TABLE `DEMO_A` (
  `ID` int NOT NULL,
  `NAME` varchar(19) NOT NULL,
  `SCORE` float DEFAULT NULL
) ENGINE=CTC DEFAULT CHARSET=utf8mb4 COLLATE=utf8mb4_0900_ai_ci
ALTER TABLE DEMO DROP PRIMARY KEY;
show create table DEMO;
Table	Create Table
DEMO	CREATE TABLE `DEMO` (
  `ID` int NOT NULL,
  `NAME` varchar(19) DEFAULT NULL,
  `AGE` int DEFAULT NULL,
  `GRADE` double DEFAULT NULL
) ENGINE=CTC DEFAULT CHARSET=utf8mb4 COLLATE=utf8mb4_0900_ai_ci
ALTER TABLE DEMO ADD COLUMN CLASS INT;
SELECT * FROM DEMO;
ID	NAME	AGE	GRADE	CLASS
1	LIOR	35	6.9	NULL
4	MIKE	55	99.92	NULL
8	ROMAN	40	94.1	NULL
16	DAN	60	1234567890	NULL
32	ZVI	35	777.666	NULL
888888	zhangdi	NULL	10000.8	NULL
1131	Hisses	1	NULL	NULL
ALTER TABLE DEMO RENAME COLUMN CLASS TO NEW_CLASS;
SELECT * FROM DEMO;
ID	NAME	AGE	GRADE	NEW_CLASS
1	LIOR	35	6.9	NULL
4	MIKE	55	99.92	NULL
8	ROMAN	40	94.1	NULL
16	DAN	60	1234567890	NULL
32	ZVI	35	777.666	NULL
888888	zhangdi	NULL	10000.8	NULL
1131	Hisses	1	NULL	NULL
ALTER TABLE DEMO MODIFY NEW_CLASS INT DEFAULT 1;
desc DEMO;
Field	Type	Null	Key	Default	Extra
ID	int	NO		NULL	
NAME	varchar(19)	YES		NULL	
AGE	int	YES		NULL	
GRADE	double	YES		NULL	
NEW_CLASS	int	YES		1	
ALTER TABLE DEMO MODIFY NEW_CLASS FLOAT;
desc DEMO;
Field	Type	Null	Key	Default	Extra
ID	int	NO		NULL	
NAME	varchar(19)	YES		NULL	
AGE	int	YES		NULL	
GRADE	double	YES		NULL	
NEW_CLASS	float	YES		NULL	
ALTER TABLE DEMO DROP COLUMN NEW_CLASS;
SELECT * FROM DEMO;
ID	NAME	AGE	GRADE
1	LIOR	35	6.9
4	MIKE	55	99.92
8	ROMAN	40	94.1
16	DAN	60	1234567890
32	ZVI	35	777.666
888888	zhangdi	NULL	10000.8
1131	Hisses	1	NULL
ALTER TABLE DEMO MODIFY COLUMN NAME varchar(32);
desc DEMO;
Field	Type	Null	Key	Default	Extra
ID	int	NO		NULL	
NAME	varchar(32)	YES		NULL	
AGE	int	YES		NULL	
GRADE	double	YES		NULL	
ALTER TABLE DEMO MODIFY ID int NULL;
desc DEMO;
Field	Type	Null	Key	Default	Extra
ID	int	YES		NULL	
NAME	varchar(32)	YES		NULL	
AGE	int	YES		NULL	
GRADE	double	YES		NULL	
ALTER TABLE DEMO MODIFY ID int NOT NULL;
desc DEMO;
Field	Type	Null	Key	Default	Extra
ID	int	NO		NULL	
NAME	varchar(32)	YES		NULL	
AGE	int	YES		NULL	
GRADE	double	YES		NULL	
ALTER TABLE DEMO RENAME TO DEMO1;
SELECT * FROM DEMO1;
ID	NAME	AGE	GRADE
1	LIOR	35	6.9
4	MIKE	55	99.92
8	ROMAN	40	94.1
16	DAN	60	1234567890
32	ZVI	35	777.666
888888	zhangdi	NULL	10000.8
1131	Hisses	1	NULL
drop table DEMO1;
drop table DEMO_A;
CREATE TABLE `@#$%`(i int);
SHOW TABLES;
Tables_in_test
@#$%
INSERT INTO `@#$%` VALUES(123123);
SELECT * from `@#$%`;
i
123123
ALTER TABLE `@#$%` ADD test int;
RENAME TABLE `@#$%` to `$$$$`;
INSERT INTO `$$$$` VALUES(233233, 11111);
SELECT * from `$$$$`;
i	test
123123	NULL
233233	11111
TRUNCATE TABLE `$$$$`;
SELECT * from `$$$$`;
i	test
DROP TABLE `$$$$`;
create table ` #`(i int);
insert into ` #` values (1);
select * from ` #`;
i
1
drop table ` #`;
CREATE TABLE `@@@@@@@@@@@@@@@@@@@@@@@@@@@@@@@@@@@@@@@@@@@@@@@@@@@@@@@@@@@@@@@#`(i int);
DROP TABLE `@@@@@@@@@@@@@@@@@@@@@@@@@@@@@@@@@@@@@@@@@@@@@@@@@@@@@@@@@@@@@@@#`;
CREATE TABLE `#test`(i int);
INSERT INTO `#test` VALUES (1123);
SELECT * FROM `#test`;
i
1123
ALTER TABLE `#test` add col2 int;
DROP TABLE `#test`;
create table `@@@@@@@@@@@@@@@@@@@@@@@@@@@@@@@@@@@@@@@@@@@@@@@@@@@@@@@@@@@@@@@#$`(i int);
ERROR 42000: Identifier name '@@@@@@@@@@@@@@@@@@@@@@@@@@@@@@@@@@@@@@@@@@@@@@@@@@@@@@@@@@@@@@@#$' is too long
create table ``(i int);
ERROR 42000: Incorrect table name ''
create table `   `(i int);
ERROR 42000: Incorrect table name '   '
set debug = '+d, ctc_lock_table_fail';
set debug = '+d, ctc_lock_table_fail_DDL_LOCKED';
create table test1(i int);
ERROR HY000: Instance has been locked, disallow this operation
set debug = '-d, ctc_lock_table_fail_DDL_LOCKED';
set debug = '+d, ctc_lock_table_fail_VERSION_NOT_MATCH';
create table test1(i int);
ERROR HY000: Version not match. Please make sure cluster on the same version.
set debug = '-d, ctc_lock_table_fail_VERSION_NOT_MATCH';
set debug = '+d, ctc_lock_table_fail_DISALLOW_OPERATION';
create table test1(i int);
ERROR HY000: The table or database is being used. Please try again later.
set debug = '-d, ctc_lock_table_fail_DISALLOW_OPERATION';
set debug = '-d, ctc_lock_table_fail';
create table test1(i int);
set debug = '+d, non_metadata_normalization';
set debug = '+d, ctc_ddl_rewrite_broadcast_fail';
lock table test1 write;
ERROR HY000: Version not match. Please make sure cluster on the same version.
set debug = '-d, ctc_ddl_rewrite_broadcast_fail';
set debug = '-d, non_metadata_normalization';
drop table test1;
